id_EXIST,lang,tweet,label
201553,en,watch various scientist on twitter be awaken to bias in science ha be interest . science ha always be bias . the bias be bad now . but the idea that science somehow transcend ideology wa evidence of it ideological power .,0
201554,en,oh man thats brilliant ! it such a basic thing to understand that human be notorious for not act in their best interest but a steady diet of capitalist ideology prevent so many from understand this .,0
201555,en,mmt ... serf a a powerful analogue for the trans struggle against what could be call sound gender ideologythe assertion of a strictly material gender reality that the introduction of new pronoun can only debase .,0
201556,en,it their term . the wake come up with it . the perjorative use of it be make fun of the term a much a it be a criticism of the ideology .,0
201557,en,there be no ideology you just hate trans people . and if you cant accept a child be trans then dont dare talk about kid cause youre no good than the loser garbage who cant accept have a gay kid .,0
201558,en,transgenderism and sexual orientation be not the same thing . i be gay and i do not support sexualize child or gender ideology .,0
201559,en,not thro coal mine steel industry gas bt or most large manufacture firm because you be part of the thatcher major government that either shut them down for anti union ideology or sell them for you and your mate to make vast profit at our expense,0
201560,en,erens anger wa so justify the found titan ideology wa insane,0
201562,en,why would god tell people to rape and kill woman and force them to a way of life that ha nothing to do with my lord ! that be why u wont get to meet my lord !,2
201563,en,so the gop be so prolife they dont want people to have abortion so they be go to kill woman instead . when be people go to realize this be all about control woman and never ha be about protect life or fetus or baby or any of it !,3
201564,en,israel we stand with ukraine . stand with humanity rusia bla bla bla meanwhile them terrorist colonizer apartheid system . kill more than a million palestinian . bomb them . kill womenkidsbabies amp men who dont hold any weapon .,0
201565,en,the sp call real men be those who kill woman everyday kungcono kwa ezo slay queen,3
201566,en,didnt bidens strike kill woman and child ?,0
201567,en,hate to say it but ...... iinspiration vsinfluence vsallureat hard to kill woman tag team title on the line,0
201568,en,can not get the death of out of my mind . my cousin rosie wa murder some year ago and it ha bring back a lot of memory . not all men kill woman but one woman murder ha too many men involve .,3
201569,en,there be multiple stretch of this drive where you will see nothing but a gas station for an hour . imagine be in the middle of a lifethreatening emergency in the middle of that desolation . this law will kill woman .,2
201570,en,liewe do see them say they have the right to kill woman .,0
201573,en,well men kill woman everyday,2
201574,en,cute of the meet police to tell woman to be careful and not get abduct rap and kill but not tell men not to abduct rape and kill woman .,3
201575,en,do you believe that men kill woman rapidly in this country and rape them every day .,3
201576,en,she say alot of predator pretend to be maintenance so they can get into the house and kidnapkill woman . it not an argument that all men be bad it about safety . im a guy and im still wary of maintenance people in my house,3
201577,en,overturn roe v wade wont stop abortion it will only stop safe abortion . this wont save babiesit will kill woman .,0
201578,en,black terrorist hate amp kill woman . your move,3
201579,en,so it fine if men kill men ? it only a problem if men kill woman ?,1
201580,en,woman be outrage by the much light sentence give to men who may not even claim to have be nag for any length of time.and to men who kill woman during sex and claim that it wa what she want .,0
201581,en,we really need more positive male role model in mainstream medium who dont have laddish and outlandish craic attitude to everyday life . and thats without touch on the culture war of give popular influencers drive time show on radio station,0
201582,en,amadour see florida at the moment im feel sort of like a laddish observation .,0
201583,en,army laddish culture comment a mistake gen sir nick carter say,0
201584,en,must be my bad head . i forget how much you love rugby . and laddish town centre bar .,0
201585,en,there isnt imo a natural laddish nickname for graham and thats important . dean smith can too easily be know a deano .,0
201586,en,pink be for someone who despise bigotry and misogyny . pink be for the empower ! pink be for leni ! the hue be ideal for her who ha always be the face of opposition to all laddish authoritarian .,0
201587,en,trivialise crime be your thing now iain ? how about i wa only just over the limit your honour or i only nick him with my knife officerthe laddish image ha slip for and you client puppet be struggle with defend the indefensible why do this ?,0
201588,en,it odd that somebody like baddiel who ha in the past black up on tv publicly praise misogynistic comedy and wa at the forefront of the dreadful reactionary laddish culture be now hold up a a progressive who can teach u liberal value .,2
201589,en,arm force head general sir nick carter defend laddish culture a world in the hand of,0
201590,en,another laddish joke !,0
201591,en,football be the only laddish thing ive ever be into . and even then probably because i wa so into memorise stats when i wa a kid . it fascinate me nowadays more for the human drama and psychology involve than anything else .,0
201592,en,for real i mean . not a part of some sort of laddish ruse .,0
201593,en,hell . but i open up the late 90 leary psychedelic utopianism seem that orchestrate not less laddish than simply cut,0
201594,en,rod stewart apparently sing for a carol service for the first time since he wa 7 . my goodness he still get it that heartbreaking huskiness and the dishevel laddish sexiness . mass raise for,0
201595,en,football use to be more than mere entertainment like strictly or im a celebrity . it use to be a celebration of ladness when it wasnt bad to be laddish and now it about something alien to a male celebration of sport endeavour and camaraderie .,0
201597,en,oasis be ok but they werent very originalthey just have more front amp good clobber amp trainer than some of their predecessor . i agree they revel in a narrow cliched tabloid view of what be work class wa about boorish punchy piss upcoked up laddish etc etc,0
201598,en,now this be laddish chant i can get behind,0
201599,en,im not reduce oppression at all . im say that patriarchal culture be the source of misogyny and be the common enemy of all who fall foul of it . and if you think that alpha male think be only for wolf then try wolfwhistle . laddish lout be a thing .,2
201600,en,do i have to be a loud obnoxious laddish bloke to get notice . or will the right woman actually come along without warn do you reckon ? answer on a postcard please,1
201601,en,these day lady dont mind give out their number and never reply you on whatsapp they be all build whatsapp tv for entertainment and market bagsshoesanything,0
201602,en,if im drive and youladies dont do this to me ill chase you out of my car,1
201603,en,why old lady dont like to comb out they roller set ?,1
201604,en,like the lady dont want it like they dont enjoy it more ... we be always funny ... they should come out with their full chest and ask for payment for have sex ... co those who do that actually get pay !,2
201606,en,he take it to far the lady dont even go this long,1
201607,en,one thing for sure lady dont really like good guy . sometimes even when you good . just be bad for no reason one day .,1
201608,en,menthe death of lion cant be announce by a goat and if a goat dare to then it ought be slaughter in feast to honor the dead lion.i mean focus on hustle bro this lady dont post break men have you ever see me on someone status ? focus !,1
201610,en,lady dont let these dude touch your face in the club they dont wash their hand,0
201611,en,crazy shit be the lady dont even mind .they will soon have a mean of identification for this source of income and they will wear it with pride .,0
201612,en,tbh bro they will just come online and be post sexual picture here and there . what else wa she expect u to say about the picture . most of these lady dont even know their worth bro . she know say i go def rubbish her na why she quick go block me . oloriburuku girl .,2
201613,en,some accusation you can tell that this be just nothing but every lady who be in a relationship with jubjub be all rap ? hai man come on guys.some of the thing he say be wrong for him to say . lady dont misuse your powers.please guy,1
201615,en,lady dont be a bore girlfriend take him to the motuary and show him the space you have reserve for him if he break your heart .,0
201616,en,lady dont let you be a lady deceive you that you aint get ta take care of yourself . we observe and pick the clean one among you mind you i didnt say pure . who even be aye ?,1
201617,en,sadly so many lady dont want him to in the first place,0
201618,en,a a man you cant claim to be a breast lover yet you be know for break the heart of busty lady ! dont bite the nipple that feed you .,1
201619,en,lady dont forget your masc on your face when go out,1
201622,en,the lil click clack on the phone screen make me feel like a lady,1
201624,en,i mean if be be adult one of them ha hair that look like a lady toy,0
201625,en,dude look like a lady ! absolutely classic film,0
201626,en,dis shit look like a lady from tha 1600s aint it,1
201627,en,karaoke version 2021 celine dion treat her like a lady,0
201628,en,after finish book i rate it 1010 in which i highly recommend and now i will begin read act like a lady think like a man,0
201629,en,not a fan of excessive sweetness also .. cant be smell like a lady . problem with those blue perfs you mention be that they have mostly be reformulate after thier release make latter batch weak or with less projection .,1
201632,en,i cut out coupon to shop grab starbucks and then blastedsang along to dude look like a lady on the drive home.im go to be the cool hip grandfather .,0
201633,en,my mama tell me treat er like a lady my dawgs tell me treat er like a thot,1
201634,en,now play treat her like a lady single version by the temptation,0
201636,en,now play the temptation treat her like a lady listen live,0
201637,en,dude doe not look like a lady !,1
201638,en,act like a lady . think like a man .,1
201639,en,share the bill if you respect yourself . some guy dont like a lady pay there bill but it advisable to offer share the bill on a date im glad my ex once do when my atm fuck me up on our first date and she clear it off with her own money though i refund her .,0
201640,en,dude look like a lady ... woman should be so proud of be out maneuver by a man .,1
201641,en,oh what the helli think the woman that life above u be sing but the sound feel like be come from my room and to be honest it doesnt even sound like a woman voiceit sound more like a little girl ?,0
201642,en,man i feel like a womani vote for for of 2021,0
201643,en,this she be definitively a man . a man body . a man strength . it be totally unfair to woman to compete with this fauxwoman.she can dress like a woman live like one etcetctec . no competition for transgender .,1
201644,en,uo 12 let me you like a woman be lanas alltime bad song,0
201645,en,woman like me like a woman like me lalalala woman like me like a woman like woman,0
201646,en,i can not believe how utterly emotionally drain i be from a john carpenter movie about an alien who look like a woman dead husband.probably his most magical movie that doesnt involve people skin fall off their face . he never do something like starman again .,0
201647,en,shania twain man i feel like a womani headband to it.i have no shame so there no sense in try to make me feel any .,0
201648,en,yes ... i do just wish the poster say fight like a woman a the language of girl continue to infantilise them .,3
201649,en,there no way to sum up our experience up in a tweet but i think i understand fairly well . my mother aunt cousin do a number on my mental health . im try my best to untangle the mess but i still feel like a woman dislike by woman . online backstabbing doent help .,0
201650,en,finish my book today which wa quit like a woman by holly whitaker and i highly it recommend to anyone try to break a habit or start anew and anyway this be hit currently,0
201651,en,ford ha one of my favorite line ever in a movie in work girl youre the first woman ive see at one of these thing who dress like a woman not the way a woman think a man would dress if he wa a woman . to melanie griffith who go to a cocktail party in a dress,0
201652,en,also sound like a woman id like to meet,0
201653,en,man of integrity . more like a woman scorn .,1
201654,en,there be nothing like a woman with tattoo . god bless you for make u all feel a little bite good every day . enjoy your even,0
201655,en,they have to earn you smell like a woman instead of an ape,1
201656,en,if you examine the human anatomy of the man who dress like a woman you know he be a man . you can think he a woman but what people think in their mind be sometimes wrong . i go by objective evidence e.g . his biology human anatomy and physiology and genetics .,1
201657,en,man think moan will win him the title move like a woman,2
201660,en,ayleen say hell hath no fury like a woman scorn !,0
201661,en,mansplaining be literally just how intelligent men talk bro,1
201662,en,i know a guy who an expert on everything . a soon a he get back from the resurrection of jfk jr. party ill let him know . a a woman youll be especially happy to know he excel at mansplaining too.youre welcome,1
201665,en,kinda sound like youre mansplaining law to a lawyer .,0
201666,en,just be block by someone for apparently mansplaining something to someone . i would have make the comment whether they be male or female . some people be very touchy see a they be basically shout out to the world everything that come into their head sheesh !,1
201667,en,the best way to prevent yourself from mansplaining be to know absolutely nothing about anything . just be dumb a hell . head empty .,1
201668,en,this bitch be mansplaining christine to me . bitch ive grow up on horror,0
201669,en,ah ok guess be add mansplaining to the list of thing you dont understand . and yes they factually do to claim otherwise be well both dim but also kinda predictable .,0
201671,en,toxic masculinity doesnt exist . thats a bullshit make up term . and so be mansplaining so please save it .,0
201673,en,i feel like i may have do some mansplaining here and if i do i sincerely apologize . youre obviously very intelligent . i didnt mean to even imply let alone treat you otherwise . im sorry if i do . it be a rough couple of day . im not at my best .,0
201678,en,this be how slick mansplaining be . i do it and didnt even know i do,0
201680,en,youre so hot when youre mansplaining genshin to me baby keep go oh yes,3
201681,en,id like to file a complaint for an outrageous display of manspreading in a public area .,0
201682,en,me oh wow someone send me their boudoir pics.scott youre one hot commodity huh ? everyone want to get with stef.me in a comfy with greasy hair and no makeup sit on the step manspreading guess so .,3
201683,en,it not a jackson wang photoshoot without him manspreading,0
201684,en,if you look at it just from a body language perspective he not wrong . but manspreading be just be a asshole,0
201685,en,a soon a i get boxer i start manspreading like a mfngl,0
201686,en,think about blake manspreading on a throne and the world be close in on me,0
201687,en,have a similar experience last week . i wa press up against the window a small a i could possibly make myself and the guy sit next to me on the bus wa manspreading so that our leg and shoulder be touch in a pandemic . i want to scream .,3
201688,en,not jelly write while manspreading to jupiter come on dude,0
201690,en,horncastles bt studio manspreading amuse me greatly,1
201691,en,man manspreading beside megan thee,0
201692,en,be that j.d . vance manspreading like his life depend on it ?,0
201693,en,me whenever taehyung manspreading on a chair ooh whats happen,0
201694,en,im think of a roommate who just leaf their stuff everywhere and just take over the space even though there be suppose to be others use it . bc thats what manspreading doe hahahaha,0
201695,en,nobody ever talk loud that the men stand behind me right now it like manspreading but voice,0
201696,en,i love both but him manspreading be go to be my death,0
201697,en,jeonghan messy hair in that fit manspreading a spicy sizzle very hot man,0
201699,en,jimin cross his leg and taehyung manspreading ohmylord,0
201700,en,dude be sit manspreading with his foot block my way and get baby rag when i be stand and walk to get off at my station and my shoe tap his once,3
201701,en,i think what it mean be precisely that we can learn through fiction song play and that a singleminded focus on debate and rigour a source of knowledge ha a history of be use to marginalize some of those way of learn and create a monopoly on intellectualism .,0
201702,en,anytime i hear about layoff at game company i just assume it wa so some vp could get a big bonus.why get rid of qa or even marginalize it ? do you want your game to be shit ?,0
201703,en,encourage and nurture your child to grow a thinker and then marginalize them when they dont follow the common narrative .,0
201704,en,ill give you phil murphy he kill thousand of senior and say the ukraine attack wa our bad nightmare which sure doe seem to marginalize what the ukrainian be go through from 5k mile away .,0
201705,en,the talk point be that democrat continue to marginalize mexican american ie over 13.5 of the u population .,0
201706,en,marginalize sector ang laborer . and part si ka leody dun . hindi siya political elite katulad ng ibang candidate . let not marginalize them further with petty exchange like this . let be good than this .,0
201707,en,how do i marginalize them ? the vax be available . if you want it get it . if you want to shelter yourself do it . the vax doe not prevent the spread . so at this point do you want everyone lockdown again ? im confuse a to what your solution be .,0
201708,en,one of the first time i remember watch him he argue that when the government prevent him from exercise his godgiven right to marginalize and ostracize nonbeliever it be government tyranny .,0
201709,en,crt be a theory that policy and law be write to marginalize one race . you oppose that .,0
201710,en,vk be bite late in give up white ball captaincy.should have do it much earlier.needs to give up 50 over captaincy too.rohit shouldnt accept only t20 captaincy . that ll marginalize him a skipper amp put doubt in the mind of youngster in the team with 2 power center .,0
201711,en,once you marginalize the less fortunate these act become evermore prominent . refugee of all race become target .,0
201712,en,the sadrist bloc marginalize the lose party in the election and be prepare for the next stage in coordination with the win force,0
201713,en,what need to be disseminate instead be the fact that think those who speak of electromagnetic attackaudio voice transmissionremote neural monitor etc . be delusional be ignorance . and society be be condition to stay in ignorance amp to marginalize people like carl .,0
201714,en,so glad im not the only one . im just disgust how they marginalize steves character a loyal dedicate guy a bore annoy etc shes never happyits not enough amp i dont like ches character either ! i dont like any of this storyline ! i fastforward just like that !,0
201715,en,this be not only a gender issue but a class and race issue . any unfair law that marginalize woman will no doubt impact black girl and woman even more . we need to talk about this,2
201716,en,thank to zillow and hedge fund and our long work a a country to marginalize the poor home ownership be not something feasible for young people or anyone without either a corporate job or family money.edit five young people plus u divorce people in our 40 .,0
201717,en,thats how they marginalize cannabis also .,0
201718,en,pelosi need to marginalize the squad . no committee assignment no influence .,0
201719,en,i dont think prisoner get much of a say . and there probably a really good reason for that . most american dont care about prisoner welfare anyway . it only become an issue a a way to marginalize trans people .,0
201720,en,4 area be relate to intersectionalitydo we know our privilege when we walk into a room ? do we know how our privilege and power may oppress or marginalize others ?,0
201721,en,brb have to go masturbate now .,1
201722,en,a dom watch their sub masturbate just sit back amp enjoy the view . the sub be fluster be intently watch like this . when the dom start touch themselves too the sub be so so eager to touch but be challenge to just sit still like sirmadame wa able to ! !,0
201723,en,masturbate . no one else then ? just me ? okay then .,0
201724,en,full length bg vids on my of,0
201725,en,the adolescent urge to anxiously masturbate late at night while everyone else be sleep when on my old family computer at my parent house,0
201726,en,this ohoo moment to masturbate kill me shey if we see people smile or talk person go start to dey masturbate abi wetin ?,0
201727,en,who want to play ? im horny .,1
201728,en,man feel free to masturbate in public because of,0
201730,en,between masturbate to porn or fuck a communist the less evil be to masturbate to porn because porn will only drain your heart.communists will drain your wallet and pantry .,0
201731,en,it surprise me too id have bet money on danny dyer but hed never say masturbate . hed be more awright gawjus you gettin some kip ? fuck that noise ave a wank,0
201732,en,make contentaka a reason to masturbate in front of other people houseplant .,0
201734,en,how come there be rich people who masturbate ?,0
201735,en,if woman have no right to get rid of a clump of cell with no sentience no self awareness can barely be call alive then men should have no right to masturbate.men kill billion of live cell daily and yet it be only wrong when a woman doe it ? that make no sense to me .,2
201736,en,im so serious when i say a lot of these men need to go get a sex doll . they dont want to make love they want to masturbate aggressively,1
201737,en,it look like the only vocabulary you enjoy employ to make any meaningful sense be masturbate . i hope it be not an act you perpetually engage in . because it go on to tell what a coward you be . get back to facebook and answer the question or stop waste my time,2
201738,en,penis feel so good this afternoon ... a slow long tease edge session so far ... just make love to penis give him whatever he want !,0
201740,en,you have to be horny if your up this late you might a well masturbate with these free video .,1
201741,en,ooh ooh i get it my new year resolution be to stop resist the urge to impose my own metanarrative onto everyone i meet im just gon na give into it and succumb to my own fictional internal universe,0
201742,en,the world will need an ample dose of meta psychoanalysis to survive the metanarratives of the metaverse universe .,0
201743,en,in meet id always be sure to keep a window open so i could get your twitter metanarrative,0
201744,en,i think he try to be clever metadata be data that provide information about the data but be not part of it . metanarrative be therefore narrative that provide information about the narrative without be part of it.reading between the line to you amp me,0
201745,en,there be many more example of this but the point be there more than enough to interpret the player a a part of deltarune and it story and part of a large metanarrative on player v the character we control . it not just baseless .,0
201746,en,i love everything about this . i want to use this along with a few other thing ive be put together.my metanarrative villain just get a wicked new mechanic . thank !,0
201747,en,why would any of them ever change in a change room instead of their own bedroom where they actually keep their clothe ? ? ? so that they can reaffirm bond gender and provide metanarrative commentary about real world trans discrimination thats why .,0
201748,en,sunset boulevardmasterpiece . phenomenal screenplay and i love the metanarrative with gloria swanson career . really shock a film like this come out of studioera hollywood,0
201749,en,what we all need be nuclear . it wont be allow to happen . it would kill the highly lucrative politically expedient metanarrative of climate emergency . instead cynically it be problematised out of the run . it utterly despicable .,0
201750,en,asuka in those movie fit the metanarrative theme of the character be what the real world public want them to be but it definitely make her a bad character but it sorta the point ? ?,0
201751,en,leapableio first ido ! 50 off the presale for tier owner ! there will be a special airdrop bonus for those who buy and never sell token until ido date . the new ido will do at least 10x ! ! let join now ! t.covlkxxrrrot,0
201752,en,this be honestly why i dont even bother share complicate perspective on here . people be so obsessively fixate on metanarrative and create dichotomy and in the world of sociology and the humanity binary be often completely smash ...,0
201753,en,youd know good than me this be just whose metanarrative i find more convince,0
201754,en,a simulacrum pose a the new metanarrative of history a resuscitation of the belief in transcendental category of good and evil it doe not describe but inscribe it doe not interpret but axiomatizes .,0
