id_EXIST,lang,tweet,label
200001,en,ffs ! how about lay the blame on the bastard who murder her ? novel idea i know .,0
200002,en,write a uni essay in my local pub with a coffee . random old man keep ask me drink question when im try to concentrate amp end with good luck but youll just end up get marry and not use it anyway . be alive and well,3
200003,en,it be 2021 not 1921 . i dont appreciate that on two ride by myself your team member look behind me and ask the man behind how many in my party . not impress,3
200004,en,this be unacceptable . use her title a you do for all the men interview . she be in fact senior to angus,0
200005,en,make yourself a hard target basically boil down to make sure they target someone else,0
200006,en,accord to a customer i have plenty of time to go spend the stirling coin he want to pay me with in derry . just like any other woman im sure of it . in retail .,3
200007,en,so only bloke drink beer ? sorry but if you arent a bloke you drink wine apparently ....... alive and well in,3
200008,en,new to the shelf this week look forward to read these book,0
200009,en,we can amp need to do good,0
200010,en,i guess thats fairly normal for a neanderthal,0
200011,en,mean woman usually end up in low pay support work when that start to change traditionalist notice unfairness that previously hasnt bother them at all .,2
200012,en,i actually have an email from liz truss today . shes live the dream . t.cow1ykdkhau8,0
200014,en,for yourself of course . let start with the so call gender pay gap with a link to an ons page . this alone be an example of why feminism be need . id like to add that out of 164 emoji reaction only 30 be laugh so it really be an issue 45,0
200015,en,dear god.colette be capable of identify sexism literally anywhere.good to see develop their own female grandpa simpson,1
200016,en,the woman will all be at home cook for the family,1
200019,en,sorry . my feminist rage at the old white man praise the two female woman of colour and elite fuck athlete on their smile . doe roger federer get tell nice arse when he win ? !,3
200020,en,why do we create comic about sexism in science ? it not just because we have a lot of spare time or like to doodle check out our blog post for,2
200021,en,you ever get so mad at your ex you send gamergate misogynist meme about about her to your 60 million fash follower,2
200022,en,in other word the game journo industry who basically know the entire time be complicit ? that cant be right . it get ta be something to do with the misogynistic gamergate boogeyman .,2
200023,en,he really shit on game journalist from what i remember start at the tail end of gamergate . he clown on developer that use unity in the past . it honestly be awhile since ive close follow it hard to pick out specific example,0
200024,en,low key she wa fr create because the incredible hulk tv show gon na do it first and marvel want them right . but these gamergate dude need to stop .,0
200025,en,one of the most important and of course undervalue piece ever publish on combat white supremacy and fascism .,0
200026,en,it especially weird because the altright on youtube be old than breadtube which wa a reaction to rw gamergate content .,0
200027,en,well theyre kind of shoot themselves in the foot by inject political drivel into entertainment . by push stress into escapism you impassion people by strip them of their release ... thus spawn movement like gamergate comicsgate etc ... people push back . c,0
200028,en,i dont even know who tf they be . only know they be part of the whole gamergate shitstorm back in 2015 .,0
200029,en,a a person who live through gamergate these new generation incels bitch about aloys peachfuzz be not what i or my hairy russian futanari with shit dick nipple hentai addict brother be fight for.give aloy a beard and a huge cock .,1
200030,en,anita a an asset ? damn i shouldve consider that . her v gamergate wa one big spectacle,1
200031,en,i want to get off 2014i want to get off gamergates wild ride,0
200033,en,the dummy who try bring back gamergate be spend his time off from wait table pretend to know stuff .,0
200034,en,they still try to grift that gamergate money arent they ? this be what i call terminally online .,0
200036,en,you know for a movement thats about hat woman ive see a lot of support go out to the woman who be sexually harrassed and a lot of them call for punishment of those involve especially the journalist who know and keep it hide for year even during gamergate,0
200037,en,it will just talk about game without bring twitter drama and gamergate bullshit into it any more but i use to love jan garbarek a a kid .,0
200038,en,the russian bot be monitor the situation involve gamergate,0
200039,en,it wa amaze and i know that anyone who might have be hesitant immediately fell in love with you when we start discuss gamergate !,0
200040,en,you have rage issue that manifest in an internet addiction . it at least start outwardly during gamergate and when that die you need a new fix you already have your view on trans people but we become the new vessel for your anger.you need help .,0
200041,en,recently i wa verbally harass by when he say i wa 52 and dont have any bitchesid like to clarify this be true but very mean,1
200044,en,bro you just harass him,0
200045,en,no two completely different situation teacher have break up the fight it wa over . simpkins go to his bag pull out his handgun and fire . simpkins claim he wa be harass but the police have state this wa gang relate . so good try but no dice .,0
200046,en,wheel of time get a trailer release for amazon that look horrible go in to try and soften the blow get downvoted and harass by them for say it look like a cw show lol,0
200048,en,a serious hardcore groupie who ja invite to the ecuador embassy . stalk harass and bully journalist and member of the public who be critical of ja . go rogue after trump election and leak a huge trove of chat log to micah lee at the intercept,0
200049,en,that would matter if anyone wa be abuse or harass . but no one wa so it just yet another bogus claim from a guy with no reliable statistic research or proof.unless you have more bullshit to post ill be wait for your retraction and apology .,0
200051,en,how be it not about safety ? do you know how frequently trans woman be sexually harass ? despite most of them avoid public restroom it still pretty bad .,3
200052,en,in other place like europe there be muslim who make it hostile to live peacefully and some make their way into govt . i have a dutch friend who get spat on and harass while walk her dog . the neighborhood she live in get so bad she wa force to move,3
200053,en,anyway a i say up this thread be for the handful of ppl that follow me that will care . for everyone else you can dosay whatever about me i really dont care anymore . too many good ppl have be harass or felt the need to leave bcuz of this fandom . i wont let them get to me,0
200054,en,this poor waiter be harass by six 30something woman i feel bad for him,0
200056,en,who harass the news team the cop or the protester ?,0
200057,en,i understand youre try to be nice and stuff . i hope you give that block button more love because it a tool that help make you more comfortable on social medium and enjoy not be harass or see content you dont like .,0
200058,en,youre give the same chance if you prove you belong at the top . woman be harass and therefore a lot dont see it a a career worth pursue . most people just want to scrim against a team of equal skill only a minority find it to be a waste of time . most dont care .,2
200059,en,journalist continue to be attack and harass by the taliban . their late victim be qais .,0
200060,en,my situation be completely different but i fear seek help because my exhusband stalk harass be still abusive etc .. and i wa scar he would use it a a weapon against me which he doe he file a rfo w defamatory allegationsjudge tell him fk off again,3
200061,en,the only people who do this be mgtow group who propagate these myth so they dont actually have to address gender issue and sit in their bubble and screech about thing they dont understand so in short you dont actually know what youre talk about,2
200063,en,i get it .. kind of . 80 of woman be go after about 20 of men and ignore the rest accord to statistic of 3 date apps . so thats a pain point for some men but be hat woman really a main component to be an incel ? and whats the difference between mgtow and incel ?,2
200064,en,mgtow ka india wing bhi hai kya if yes then they would need more traction . baaki promale andolan ki reach bahut kam hai imo .,0
200065,en,now the mramgtowincel crowd will double up on their online womanhating angries.because it usually woman who turn these chomos in . who then run and hide in the prison church . then get out and find a new career in qristianity . and abuse people again .,1
200066,en,black femcels nigcels hoteps d ! vestors femininity nut black luxury ppl black mgtow amp other online group fascinate me lolthe way they twist legitimate idea abt race and oppression to fit their catastrophizing worldview inform behavior that lead them back to w be,1
200067,en,950 iq mom and dad also have no way out . these mgtow jp follower do not know what make relationship stable . it be not always no way out.biggest reason for stable marriage in previous generation be that they get marry early .,0
200068,en,i have to look up mra and mgtow . what ? ? ? ?,0
200069,en,if you know anything about the evergrowing mgtow movement you know that it be make up of menwho be in their early 30 who refuse to put up with the up and down of be in a relationship,0
200070,en,im have a hard time deal with the pervasiveness of misandry in society . see shit like that all the time make check out more and more appeal everyday . the way not the suicide way,0
200071,en,international men day,1
200072,en,some be a key word in mine lol . it wasnt a minority and i also didnt generalise them a incels . i say that incel and mgtow culture be get close to the black community because they may not be incels but it a road and their line of think could take them there .,0
200073,en,be alpha male a movement ? something like mgtow ? ?,0
200074,en,sou base cria redpill mgtow blackpilado frio patrick bateman kanye west drive 2011 blade runner ma tudo isso ironicamente,0
200075,en,woman already suffer for sexual contact . much of it be not consensual a wa point out earlier.why not hold men to the same standard ? oh right youre one of those mgtow arrest adolescent,3
200076,en,i have another article this month ! this one will be controversial because it deal with mgtow ... be it hate speech ? do they hate woman ? be they dangerous ? check the answer in this post ...,3
200077,en,so date a man be inherently racist cause you be date your oppressor ? how do these fuckin idiot think they all get here ? a stork drop them off ? lol you wonder why men subscribe to the idea of mgtow be because of dumb shit like that far leftist lunatic .. ffs,0
200079,en,thank you for promote mgtow,0
200080,en,we all do steph . it 1.01 black pill mgtow incel 21st century bros before ho playbook chapter one date survival guidedont go into detail about the taste of the waaaaaater . it an argument starter !,0
200081,en,well . avoid your face become a baseball glove should be in every man interest.bring back the metrosexuals ! you can use nice product without be gay or trans ! we mock the metrosexuals now look what have,0
200082,en,what be your story notallmen a we share ours and youre in them . if you dont recognise yourselves then mace and legislation or your tweet tell other men to listen honestly dont matter . it start with you . what have you and your mate do that you now know be not okay ?,0
200083,en,co it doesnt happen and if it doe why should all trans woman be vilify for the few outlier ? if it then it too . either all men get castrate co they cant stop rap or we simply just educate people that rape be bad instead,2
200084,en,in before the reply of im a man who go to therapy follow up joke that miss the mark,1
200085,en,it patriarchal world . woman can have no job yet can live on her own . not men .,1
200086,en,remember the time lewis accuse of not do enough about racism and he come up with a kind of response ?,0
200088,en,have a penis . not all woman have a vaginanot all folk ascribe to the binary,0
200089,en,why be i still like wow guy still publicly say this shit in 2022 ? ? ? clearly there some small glimmer of hope in me that need to be quash immediately . queue the notallmen brigade,0
200090,en,this be also a very good explanation for why privilege can blind a person to oppressionthey do not feel disadvantage because the predatorsopperssors lookact exactly like they would amp so feel threaten by accusation possibly because they have good intention e.g,0
200092,en,obviously but sorry the fisher exact test leaf no doubt,0
200093,en,stop say embarrass the fact yes it men carry the guilt for the all the mischievous do by those bastard until the female realize themselves it,1
200094,en,notice how civilian men who dont hold any political power in their country keep tweet we be do thisthat ? this isnt cod . war isnt a friday night twitch channel . youre tweet from home .,0
200095,en,be i the only one who read a no_tall_men ? not make any deep point here just confuse not an infrequent occurrence .,0
200096,en,let look at your retweetsnintendo switchsportsnotallmenwow youre really hit hard on the social commentary ! how could i keep up ? stop front and just be honest with yourself . still figure thing out be the only truthful thing youve ever say .,0
200097,en,need to step up their game because can be trust to keep their own behaviour in check.if a schmuck like me can be a decentish human be for 51 year despite many many instance of not be sober andor in a legal frame of mind you can do it too ...,0
200098,en,the tag be currently trend in nl . i know it not all men but it be heckin hard to trust men when youve have men you know a well a random strange force themselves onto you or touch you without consent.just put it out there . watch the video below .,2
200099,en,this be why can suck a dck . treat every gun like it load and treat every man like he might strangle you . simple a that .,2
200102,en,an excellent thread on how the patriarchy deform men soul and damage their life .,0
200103,en,okay but what if it wa two woman say fuck the patriarchy ... that would actually be so sexy of them,1
200104,en,you be toss me the car key fuck the patriarchy pee stain on the grind,0
200105,en,rep. ayanna pressley dma claim that recent be root in a patriarchy and . conservative activist ryan girdusky point out that nearly all of the nation in africa ban abortion . be they prowhite supremacy ? he ask .,0
200107,en,patriarchy sit at the intersection of control of woman property amp war explain how non discrimination base on gender protect woman from,3
200109,en,blackness be not a shield for men to protect themselves from criticism . especially men ignorant of all the patriarchy in non white country . female baby be abort in china . woman be isolate in menstruation hut . breast iron . fgm . poc know what sex be .,3
200111,en,because a bronze age tribal patriarchy be a good model for a modern technological society right ?,0
200112,en,yes . because a control supply of sex be a good thing ya heathens.no one be happy about open sex and easy woman than the patriarchy . ill tell you that much .,2
200114,en,transphobes be so weak and cowardly that instead of go after real misogyny amp the patriarchy they resort to target a different vulnerable group and become the abuser themselves in order to feel powerful . i see you . the bully become the bully isnt a cool look .,1
200115,en,idk it just different . maybe due to ingrain patriarchy or something . i use to tell my bm id love to watch her fuck a girl but another nigga ? hell nah,1
200116,en,youre not god or my father or my bossah yes the three gender of the socius a summary of universal history . the primitive code of the earth the despotic overcode whose royal incest establish the patriarchy and the civilize capitalist machine,0
200117,en,i really like it ! dont expect traditional horror it more of a terrify folk tale . very atmospheric and a fascinate critique of patriarchy .,0
200118,en,they can fight for hijab but not against triple talaks four mariage ritual even when they be exclude from education exploitation marital violencesthey dont protest they like to live in patriarchy ... i hope they fight for follow matter too,2
200119,en,the whiskey and cigar the 99 dollar seminar the mustache wax the secret society the we need a patriarchy discourse ... into the trash it go . if youre feel a crisis of manhood then just be handsome and stop talk or at least stop talk like that,0
200120,en,i would be glad to see the violence on twitterng over the next couple of weeks.both patriarchy and misandry fcs be in top form and they be prepare to go nosetonose . let have it .,0
200121,en,actionaid conduct a survey on street harassment they find that 79 of woman live in city in india 86 in thailand and 89 in brazil have be subject to harassment or violence in public a have 75 of woman in london uk .,3
200122,en,over 400 people use our helpline this year . you can donate 10 or more to fund it in 2022 amp help more people !,0
200123,en,81 of woman and 43 of men report experience some form of sexual harassment andor assault in their lifetime.so it happen and i could be bother look .,0
200124,en,explore photo and excerpt from the conversation to learn how activist view advocacy allyship and accountability within the movement . and check out on instagram !,0
200125,en,i will leave this link here this be the global statistic for street base harassment only . youd be shock a a man to see how high the number and percentage be .,3
200126,en,thousand of girl and young woman have share their story . story of group harassment of violence show theyre .,3
200127,en,chalk back the girl and youthled street art movement to by natasha harrisharb and sophie sandberg . read here,0
200128,en,catcall of college park launch to spread awareness and spur dialogue about a culture of catcall . this harassment can ha an impact on victim and restrict womens engagement in civic life . every woman ha a street story . whats yours ?,3
200129,en,always relevant . fim by maureen,0
200130,en,be speak out against april 39 ! join u by use chalk pro respect message flyering amp speak to friend about why this issue must end ! 12,0
200131,en,be . it not a compliment . it never okay .,3
200132,en,so important for u to take a stand,0
200133,en,however in my experience when we share our unique story and come together a a community we create powerful conversation and cultural change .,0
200134,en,have a story of street harassment youd feel comfortable share ? send u a dm or email u directly at itsnotacomplimentmelbourne.com .,0
200135,en,1 stop street harassment 2018 study on sexual harassment and assault .,0
200136,en,accountability be not a sorry it be action . it be deep self reflection and change of behaviour . natasha and maya photo by,0
200137,en,i dont know where this wa but some state do have law against this sort of behavior .,0
200138,en,... a man be entirely responsible for his own action .,0
200139,en,tw pedophiliajust a few of the story from our chalk event last week.show me what those hand can do . say to an 11 yoi bet youre so tight id love to fuck that . say to a 9 yoget pedophile off the street . t.cods5kp5qw1g,3
200140,en,be an upstander today and everyday .,0
200141,en,what matter be the function of the human right theory . humanity matter for tigray amp tigreans ! ! !,0
200142,en,301 day . even under the intense pressure of be discriminate against amp try to get his amp all deaf athlete voice hear this fantastic young athlete remind u,0
200143,en,i will not go to school without my sister . i support my sister . an afghan boy . true man . wise human who know the sequela of exclude half of society.education for all afghan,0
200144,en,when pakistani army go to bts concert,0
200145,en,sex pistol god save the queen via,0
200146,en,djín be just a important nonetheless ! come lock into slimzosrecordings livestream on instagram thursday even from 7pm uk time and i will try to prove my claim ! !,0
200147,en,society set norm ! happy men day though !,0
200148,en,there be no place for in this world ! !,0
200149,en,abolish the monarchy via,0
200150,en,with grow demand for the president to resign . we get ta wonder when will he learn ? stop be violent !,0
200151,en,no child will ever walk 10km to school . gogos makhulu wont hire bakkies for clinic visit motorist wont have to drive to town for fuel etcnb not mean to offend anyone it merely a suggestion . i stand to be correct ! ! !,0
200152,en,. good ol albert,0
200153,en,spend some time in ghana ! such a fun place to spend this fine day august 27 1963 . wonder how the civil right march will go tomorrow . i know my bois will kill it !,0
200154,en,and nobody doe anything while pleople die ! why this cruel indifference why !,0
200155,en,ahhhhhh . my hand give grow tire from all the write . but i be so grateful to announce the publication of my second work . lady dont jump off your seat do get ready for some reflection upon marriage ! ! ! go get your copy now ! xoxo 1700,0
200156,en,in the mood for a diy spa day ? pamper yourself and your skin with luxurious yet affordable equal skincare products.include equal product in your skincare regime today !,0
200157,en,protest again this saturday 9am in front of balise toyota scion west springfield riverdale rd and sunday 9 be at intersection birnie ave and prospect,0
200158,en,on the anniversary of woman gain the right to vote and stand for office in politics in turkey we proudly declare that we respect the right of all woman start with our associate in our workplace and we act together to build a more equal world .,0
200159,en,strike strike strike ! we need to stand up for womens right ! woman deserve equal pay and equal right ! the triangle shirtwaist factory need to have good work condition we need to be equal !,0
200160,en,100 follower ! my heart go out to the community a it ha show to be the most inclusive and sweet group ive ever come across on the internet ! shoutout to for be my 100th follower !,0
200161,en,caption exist in post ! happy men day .. ..,0
200162,en,be around the corner which mean it time for a that wed love for you to be a part of ! tampcs apply . final entry image will be choose by basis amp will feature in our video release on march 8th 2022 .,0
200163,en,this be the year yes to woman be to give and take equal opportunity at all level and in all field . it all about ability capability and responsibility we a woman have same if not more .,0
200164,en,to all the lovely lady .,0
200165,en,here some halftime entertainmmt for yall watch the v game i still have nightmare about this block,0
200166,en,let celebrate international 2022 and help to collectively for woman around the world .,0
200167,en,afghan woman can not be part of any sport include cricket a that would expose their body the taliban,2
200168,en,we write our song strong woman to celebrate the woman in our life and the achievement of woman all over the world !,0
200169,en,for all the womens out there !,0
200170,en,just eat a big dinner with and friend to celebrate 3 pureblood able to coast by . no lame vaccine check or anything . thankfully seem the commie arent get the entire script from who and the wide cathedral . kinda business a usual again,0
200171,en,what a wonderful advert for the brilliant vaccine programme continue to save life improve quality of life amp reduce strain on nh service . this be one fantastic reason for the nh to be cherish by public everyday,0
200172,en,shivaami be join the force this to by bring lead woman entrepreneur to share their success story online.register here 8th march 2022time 3 pm to 5 pm,0
200173,en,this be the day to salute all womens struggle to secure a dignify place.women be inspiration for others in so many way . my special honor tribute amp respect to madam . happy,0
200174,en,custom color inspirational aviation gift funny pilot mug amelia earhart quote ceramic coffee cup mug for her,0
200175,en,to all woman deserve of their special day . nollaigh na mban shona daoibh .,0
200176,en,feel that i have raise a care amp love 13 yo who be our next gen feminist amp ally . i wa cry of joy inside when i get this text . not only we must for woman we need to do it for our child .,0
200177,en,above all be the heroine of your life not the victim nora ephron . click here for 48 inspirational quote for woman .,0
200178,en,womensday 1,0
200179,en,may i ask when you will announce the theme for 2022 iwd ? im look ahead to program and try to work with your theme each year . thank !,0
200180,en,lauren case owner of bun bakery share her insight with us.what be your most valuable tip to share with other woman entrepreneur in 2021 ? be patient be alert be understand be kind to yourself amp persevere !,0
200181,en,hearth,0
200182,en,how can the right be sooo wrong ?,0
200186,en,im bring this discussion back up today because woman have be marginalize and physically take advantage of . it time we fight and vote to speak once again for allvotebluein2022,3
200187,en,be for .vote for beto .,0
200189,en,daughter be take me to va today . may i say i really dislike the pain from fall . ugh have a good day folk . so much to do in so little time,0
200190,en,completely agree . never before have i felt a vote decision should be make on the basis of one policy.both and be off my list . it not without a big sigh that i say the look like the only option so far .,0
