id_EXIST,lang,tweet,label
200797,en,omg ... i think i wa the only one in the world who remember another dumb blonde singersongwriter hoku,1
200798,en,you have to be a dumb blonde ! it wa trump who cause this ! how dumb can you be !,1
200799,en,dumb blonde of the day,1
200800,en,anyone can offer commitment love safety ... but to offer end you with bare hand ? it doesnt even take a villain to be sleepless over this ujiko at a fancy dinner confess eternal loveafo silently god i just wish a big dumb blonde would fuck me up again .,1
200801,en,shhh be quiet or hell get embarrass and start preach,0
200802,en,trump republican embarrass by epic legal order via gop charge with a crime how shock ! ! !,0
200803,en,it so weird that people just cant accept that he do the wrong thing who would ever be embarrass to be aussie ?,0
200804,en,incorrect . plus youre a grow as man id be embarrass,1
200805,en,my friend when they see a song on spotify that be download but not like and the playlist i download be one make by me specifically for download and i say that i didnt like that song because im embarrass to tell them,0
200806,en,im embarrass for you .,0
200807,en,cry and embarrass play undertale rp on roblox and my friend join me i cant,0
200808,en,even if you get embarrass and blush you can still confront hard thing .,0
200809,en,apparently you have to be happy about spend your hard earn money to go and watch u get embarrass by liverpool and city and clap the manager after . norwich and villa show more ambition,0
200810,en,what a smug arrogant fullofhimself arse ! putin must be bricking himself that the prick who embarrass a nation with his dont let scoatlan doon bellow be monitor the situation . jesus do indeed weep !,0
200811,en,how embarrass be you to be a member of today medium ?,0
200812,en,need the help of 30 fandom to vote and bts still win with a 17m gap arent you guy embarrass ?,0
200813,en,gtfoh loser dick rider ! fan like you that love doofus player amp manager have u in this bind . go watch the pirate their fan dgaf if theyre team win title or get embarrass by their hat rival on a daily basis . mofo loser .,0
200814,en,embarrass to say it martina navratilova . a a kid i wa a big chris evert fan and then i realize not only how great wa a a player but that she wa an even good person . still be .,0
200815,en,man im embarrass to admit id draw myself with dio and not in a sfw scenario,0
200816,en,im aware of the foible of the article in question have be mistakenly issue one myself but i guess i wa always too embarrass of it not to be very careful have to actually use the damn thing,0
200817,en,thats absolutely adorable . and witness him be embarrass . i love it .,0
200818,en,if you want to stay in the unite state . texas isnt do anything the people of texas be finally wake up and realize theyve all be screw by the gop . woman especially you need to get out and vote . the nation be embarrass by you all . do good,0
200819,en,how the fuck can you blow a 249 lead at the half . fuckin atrocious . honestly embarrass .,0
200820,en,no no it ... he shake his head . it not you . i didnt even notice how long be we even ? face flush clearly embarrass he clasp his hand together . it wa obvious once you notice it how damage the hand wa even with the silk glove hide the,0
200821,en,tj hate alexa cause she be a powerful woman . an oppressor hate an empower woman who know her worth,3
200822,en,they have the ability to kill big difference . no court on earth can judge soul .... only godjesus can .,0
200824,en,i dont fvck w religion or religious belief but whenever i saw maria lionzas statue i felt there wa something inspire about it . she felt like a really empower woman an icon with a great story behind .,0
200825,en,yes modern empower woman !,0
200826,en,we support vp sara for this come election . an empower woman that be ready to make a big change for the entire philippine .,0
200827,en,an empower woman be not just about be bold and brave . a conservative traditional woman can be one . they be not weak nor afraid to step out of their comfort zone . it just that different thing empower different people.there be no one way to be a woman florence g .,0
200828,en,why kill her ? i find it amuse amp a good show to see this empower woman kiss low iq bidens as just to work under him . if kamalas so smart shed be president by now . it will be entertain to see kamala get on her knee amp kiss more ass for her next covet job .,1
200829,en,im love the sas that anu aunty be give doucheraj and mkk lately her growth of be a timid submissive housewife and semi empower woman be so fun to watch especially when her team kinju samar et al support her,1
200831,en,leni sound like an advocate talaga of community development . this be why im vote for her shes an empower woman !,0
200832,en,this be how an empower woman talk like . gajab shrinate aunty,1
200834,en,the film portray ball a a remarkable fearless and empower woman who work hard to perfect her art .,0
200835,en,that tinnie little typo that change everything she be empower woman and i love that .,0
200836,en,estoy fascinado con esas playlist de youtube tipo empower woman you be the baddest bitch in high school o you be in a toxic relationship e un paraíso nuevo,1
200838,en,you want to be a strong and empower woman ? then grow a spine strong enough to look at your own sin and shortcoming square in the eye and be will to face them head on . only weak woman blame men for everything .,1
200839,en,empower woman kiss phenomenal queen,0
200840,en,you sound mad bro . do the empower woman hurt your feel ?,1
200841,en,i be ! and i be honor to be celebrate and recognize by a a woman sit at the table for 2021 .,0
200842,en,bashfully at first grow into acceptance and then empowerment .,0
200844,en,incorrect . the term use to be use interchangeably with hermaphrodite or eunuch in english however the indian ministry of social justice and empowerment redefine it a of january 2014 .,0
200845,en,and miss me with this fake black girl empowerment shit . we attempt to destroy a man off of her word alone . now the court say there no dna and the police say there no bullet fragment .... so the court amp police be still not enough for tory lanez to be absolve,2
200846,en,once make equal to man woman become his superior.who can really define woman empowerment andor emancipation ?,1
200847,en,advance barista skill train for youth now happen in kampala.thank you iwca uganda chapter for support and empower barista house to create a difference in the life of these young star . woman in coffee youth skilling womenampyouth empowerment advancement,0
200848,en,go back and forth between sorry hoe hate me cuz im the it girl and it feel so good to be alivee but it okay because they both black empowerment song from black woman,0
200849,en,jam harden . hell of a ball player . but the absolute definition of a diva . completely bail on the rocket . die now to bail on the net where he want to go . this be the shitty side of the player empowerment era .,0
200850,en,hey yall my spiritual empowerment brand be almost to 40k follower on ig . mostly everyone on here already follow me but id really appreciate it if yall could rt this for the people that dont so i can hit my 40k goal by new year . it on ig . love yall,0
200851,en,sophia and riley receive the family empowerment scholarship for student with unique ability through . they use their education save account to pay for train session . learn how it expand their world .,0
200852,en,i appreciate men yang very vocal about woman empowerment amp advocate about our struggle . you guy be the best !,0
200853,en,never forget that kobe spend an offseason beg the lakers to trade him and they didnt . everything with ben simmons be in the hand of the six . the empowerment talk be nonsense,0
200854,en,first time im say fuck woman empowerment .,1
200855,en,kindly download and signup on the app and witness a new era of digital currency that believe in the empowerment of community .,0
200856,en,the late update for include cio leader face unprecedented empowerment and challenge top prediction and what can you learn from with i2m part 2 .,0
200857,en,they should be empower our community not empower themselves . have you not see westminster the past 21 month how dare a tory talk about empowerment after what the con have do in con the nation,0
200859,en,i suppose theyre good than the egirl onlyfans slut who just attention seek from simps for their crypto there plenty woman on ct who be cool and fun to interact with . this be just a pile on to show support for a shitty person in the name of female empowerment,0
200860,en,when your super excite today wa your first meet with my sister keeper girl empowerment club you race home and design your poster,0
200861,en,idea have consequence richard m. weavernotes on epistemology rev . john j. tooheytheres also a brazilian author i would highly recommend but afaik he ha only one full book publish in english,0
200862,en,ha yeah a classic case of epistemology beget ontology,0
200863,en,our tip of the week be the book a continental guide to philosophy by . start with 3 fundamental question about metaphysics epistemology and ethic macready guide u through the philosophy of plato descartes hume kant nietzsche schopenhauer and arendt,0
200864,en,read widely always goodbut important to distinguish ontology realism and epistemology positivism . critical realism ha commitment to realist ontology but permit epistemic relativism,0
200865,en,modernist figure they could reset everything by start first with epistemology and give up on metaphysics . now we be sink into the abyss of postmodernism . happy happy joy joy .,0
200866,en,be woman sign a letter against terfs . it standpoint epistemology and it almost always ha the end effect of trample the disadvantage in a group .,0
200867,en,add understand ravel to my unending list of thing to learn . push toward the top since thing that be like knot but be not knot slightly break my epistemology .,0
200868,en,no it an engagement in subjective epistemology . i have subjective reason for it . and the word be use all have subjective mean . point at everything i say and go youre say you know that objectively ! be a bad argument because i only know it subjectively .,0
200869,en,her conclusion and her critique of eurocentric analysis masquerade a liberatory be on point . but she ignore the fact that antioedipus ha similar critique of colonial epistemology a well .,0
200870,en,rand demolish epistemology with fact and reason !,0
200871,en,empirical evidence be of central importance to the science and play a role in various other field like epistemology and law .,0
200872,en,tribalism be a matter of social organization not epistemology.your malapropism speak volume about how classical liberal overestimate their ability and thus make poor if not reckless steward of their inheritance.the person without a tribe be fragile and rootless .,0
200873,en,i think a lot of people believe in a soft standpoint epistemology but very few people believe in the existence of a coherent feminist standpoint,0
200874,en,currently do my ma dissertation and try to work out all those wowsers terminology ! if you can help with ontology epistemology and anything in or even vaguely relate to anything research relate which would help id be eternally grateful,0
200876,en,since true think dont come with a special glow announce themselves a true we cant use truth a a marker for wellformed worthwhile belief . in,0
200877,en,i think an objectivism set up pretty big obstacle in the way of appreciate any kind of social epistemology ! like i think an objectivist view these field always with the suspicion that there be moral relativism and hostility to science lurk behind the page .,0
200878,en,dont mind him if you phrase a question like this for a research in qualitative analysis this shit aint go through ethic or your prof . act like english be so hard to comprehend . his positionality and epistemology be clearly bias since he doesnt know we learn .,0
200879,en,there a lot tribal epistemology masquerade a skepticism,0
200880,en,i start teach this worldviews lesson today to ks3 today amp the what be real questionnaire from make a fab introduction to a unit look at epistemology . i have be use it with yr7 today some of the language be hard but with guidance they could access it,0
200881,en,it quite clear . when we say that there should be equality between both the gender atleast the rule should be same . it really incomprehensible why drs be not there for,0
200882,en,my dear a wife ha never be a servant in her husband house ekyo kikyuuseinfact it the husband who be the servant in his home because you have to work hard in order for them to have a good life yes there can never be equality between the two in the family,1
200883,en,12 doe equality between men and woman mean equality base on a correct understand and distinction of basic physical strength physical difference vocal difference and the nature of masculinity and femininity a live thing ? translation site use,2
200884,en,jason want to perform a two tail test for equality between two independent sa,0
200885,en,crt popular definitionracial wokeness ensure that equality between the race can never exist because it make it impossible to move beyond racism of the past and tell black people that they be victim of a white supremacist society in which there be no way they can succeed,0
200886,en,boris johnson never brush his hair show gender inequality be very much alive say hillary clinton clinton will not live to see true between men and woman gt,0
200888,en,wait for the day we have bookmark folder and equality between twt web and app,0
200889,en,what i really dislike about this stuff be the implicit assumption of equality between the author call for u to end our support we might and it would really happen soon and iran stop their support come on ? ! .,0
200890,en,yahwe need equality between both gender . cause honestly we way too quick to cancel male than female in society . i be not take side but truth be we have all normalize woman cry rape to get back on the other gender . i believe nobody . i wa not part of their relationship,3
200891,en,remember when ryback get fire from wwe for go on the internet and pitch socialist contract equality between upper and lowercard talent ?,0
200892,en,terminological mean sayyid sharif say justice be a point of equality between excess and deviation which keep the side equal and come to a standstill on the truth . political system of islam prof. ghulam rasool cheema,0
200894,en,so how about leave islam ? equality between men and woman ? equality between non muslim and muslim ? how about you agree to be treat the same a nonmuslims be under the sharia ? do you accept ?,0
200895,en,the rate comparison of equality between dn and d be bake right in . if you make the assumption which be make by the scientist not the model that d be neutral then reject the null be reject equality between dn and a putatively neutral class of site d .,0
200896,en,it be sad to think that we a a people should be more evolve than this but it be this archaic mentality that hold u back and diminish and progress we hope to make in the fight for equality between men and woman . be equal be not be weak .,3
200897,en,what be this ? you want me to promote equality between men and woman ? woman be only about 50 of the world population why should they get such special attention ?,1
200898,en,to achieve equality between district and boundary have be remove enable travel anywhere in the region with the same ticket.i be sorry for the delay in our reply i hope this help clarify . beth 33,0
200899,en,this negate all experience of caste oppression and assume historical and modern equality between caste that simply doesnt exist . nothing to do with the west it illogical . like i say thing can definitely be hurtful but to say it casteist be flaw .,0
200901,en,let me reiterate that i dont buy asian privilege the same way that i dont buy white privilege . fundamentally it tribal essentialism and that shit be never go to solve any of our problem .,0
200902,en,maximalism of welfare wellness wellbeing amp prosperity and minimalism of burden struggle menace trouble amp problem be the very essentialism of leadership,0
200903,en,and thank you for address this . essentialism in my opinion be one of the incorrect description of the world that ha do the most damage to both individual and society . it prevent seek or even allow change and deny the dynamism of the world around u .,0
200904,en,youre go to mask up my child and then teach them race essentialism ? um ... no ? and like over my dead body . base,0
200905,en,listen to one direction on repeat to write this paper about biological essentialism and the myth of motherhood lt3 this be the future simon cowell want to create u guy just couldnt see it yet,0
200906,en,pointblank open nervetrainers rebound essentialismdrone letter clothespin,0
200907,en,i feel you . make this whole matter even more annoy to deal with be we even refer to theory of human invariance a essentialism pile even more baggage onto the whole mess lmao,0
200908,en,cultural marxism race essentialism postmodern gobbily gook crybaby socialism mental illness daddy issue with a liberal art degree and position of power,0
200909,en,yes but wahi masla hai all these sexology term basically reinforce biological essentialism while try to be inclusive,0
200910,en,and then link an article about creativity v racial essentialism and somehow miss the point that those idea be exactly why the gop doesnt elevate these people in opposition to the dems who be use it for wake clout the gop just doesnt need them and doesnt care .,0
200911,en,beyond the north wind the rise and fall of the mystic north essentialism the house in the cerulean sea the four agreementsoctober every heart a doorway the book of magic the memory police the body keep the score norse mythology circe best light read,0
200912,en,im fairly certain kendis racial essentialism be in itself pure racism and all people should laugh him out of the public square,0
200913,en,race essentialism be a foundational assumption in the racial reconciliation discourse,0
200914,en,oh yeah it handinhand with their commitment to gender essentialism woman be dainty and feminine and eager to support their husband amp his need . a real man doesnt like anyone too fat too androgynous or too demand so how can you blame them if they stray ?,1
200915,en,where he wa wrong of course wa to speak of white liberal . and throw out the race essentialism even then there a lot travel under that liberal banner .,0
200916,en,the very idea of alignment that there be objective real category of morality that can be classify in term of good evil law and chaos be essentialism of the kind that be be object to . alignment in dampd be real objective moral differentiation that be surely ...,0
200917,en,an essentialism . conservative old white uncool . minority young cool wear sunglass at night must steal their juju .,0
200918,en,black people love race essentialism and race science while claim to hate racism .,0
200919,en,right amp thats essentialism which be man make system gtgtgt logo . the next step be to point out the essentialism amp they can 1 remain silent and be complicit in an essentialistidolatrous praxis or 2 speak up by pick one of the two terminus essentialist vs. pullingback .,0
200920,en,why do you need to teach kid about gender essentialism ?,1
200921,en,everyday sexism bring to you by the 2021 century,0
200922,en,the amount of filth in my mention after this story wa ... something the new lawsuit detail nightmarish condition of rampant sexual harassment at be both heartbreaking and unsurprising . her lawsuit also blame s tweet a it should,3
200923,en,you learn that nothing be necessary armour you must carry with you leave utterly speechless by s read of her poem about how woman and young girl expereince everyday sexism,0
200924,en,i cant understand how a math teacher would discourage passionate young woman from take a much math a possible . she want to take the hard class . she like work hard at math.everyday sexism .,3
200925,en,call undermine authority and everyday sexism,0
200926,en,there still a lot of work need to be do in stem field when it come to how we conduct ourselves a men towards woman . this article be spot on .,2
200927,en,the reality of police everyday sexism and misogyny . they joke about rap woman and stuff them in the boot female police officer tell their work story,3
200928,en,bad feminist invisible woman feminism be for everybody on intersectionality too fat too slutty too loudwe should all be feminist everyday sexism what we talk about when we talk about rape a room of one own girl woman other the color purple circe the golden notebook,2
200929,en,eutelsat sign up to french initiative against everyday sexism in the workplace,0
200930,en,the release of the human right commission investigation report wa block by firefighter union chief peter marshall who deny claim the state fire service be beset by everyday sexism that place woman at risk of harm .,3
200931,en,an hbo miniseries on catherine the great expect viewer to welcome a 70something helen mirren play a 30something in perpetual fury about everyday sexism.why i stop watch historical drama .,0
200932,en,the trial by laura bateshive book amazon,0
200934,en,cry wolf everyday sexism,0
200935,en,everyday sexism . katie price 43 arrive at court to be sentence for drinkdriving,0
200936,en,an example of everyday sexism in our university and major discrimination against woman .,3
200937,en,what about the warn sign before this happen ? the joke about kill woman and stuff their body into the boot of car ? his nickname the rapist ? the testimony from female officer about the misogyny they have to put up with a detail by everyday sexism ?,3
200938,en,everyday sexism be worth the time !,1
200939,en,. md anz steven worrall say workplace harassment be a scourge on our society leader have to realise that just because they be not hear about it it doesnt mean it isnt happen . t.cocisd5oiclp,0
200941,en,dont know if selfexoticization be always a matter of be complicit . english be a native language it come to u through invadersrulers a most others do . sure it belong to the privilege but almost the entirety of our anticolonialist discourse be articulate in eng .,0
200942,en,in the presence of power asymmetry the line between and exoticization or othering can quickly become blur . the be value in see what human be have in common despite different local circumstance . that be the principle of humanity .,0
200943,en,the exoticization dream sequence of zendaya . the native fremen woman be cod for asian black and middle eastern woman . if thats not orientalism then i dont know what be . im bring this up because the film be about colonization .,1
200944,en,just go for that urbex bullshit people love and have future lara excavate former olympic village and missile silo . you sidestep the colonialism and the exoticization of other culture and you deal constantly with the excess of american culture,0
200945,en,hey im one of those and while i have nothing but love for femboys it certainly not a term id use to describe myself . also please be mindful of accept the exoticization of third gender by cissexist anthropologist uncritically .,0
200946,en,exoticization of my mental illness be not empathy !,0
200947,en,let alone it mimetic function of reinstate the exoticization of asian flavor present throughout american restaurant . an ontological and aesthetic expansion of the white relationship to the exotic that also serf to be antiblack .,0
200948,en,icymi dodgy language skill relentless exoticization and a bizarre obsession with stoat . i read clavells shogun so you dont have to .,0
200949,en,have be in an industry that glorify this and relate behavior can confirm . exoticization and fetishization be absolutely rampant and have be since they ram their boat into africa . except now it a different kind of socially acceptable itll never not be weird .,0
200950,en,but this be professional journalism not someone be twee to entertain their friend . this be something strange i cant figure out whether it condescension or exoticization or what but it not normal .,0
200951,en,representation without justice be mere exoticization,0
200952,en,the too simple explanation they use drum and thats cool we use psychotherapy and thats crap could be basic exoticization and could end up encourage prejudice like psychotherapy be useless to fight depression you just need to go sunbathe it up to you,0
200953,en,i get that oriental in this context be a descriptor of a product not a person but it still squicky because it imply an outdated concept of exoticization . consider the location of the product though it aint surprise !,0
200954,en,heavy thread . first thank you for honour u with share this content i think there be a lot of exoticization with people who have psychotic symptom . we love story about exotic hardtoimagine experiences.i think a lot of that lxp be coopted and use to build 2,0
200955,en,22 ... racism in the hobby and outside it more difficult . so yes theyre be call out about it . because it more exoticization and dodgy concept that we dont need to deal with on top of the regular one .,0
200956,en,i kno this anger ppl amp while i disagree wit premisejosephine baker do capitalize off racial ambiguitycolorist exoticization amp those same opportunity werent a available to dark skin african american female entertainer .. this delf into it wher role in la créole,0
200957,en,exoticization of an otherwise neglect community . also i wouldnt put past that lot to send in usurper .,0
