id_EXIST,lang,tweet,label
202285,en,from that the harassment begin this can range from general trash talk to gender base sexual harassment . which if we look at the social norm and the box men have be put in it doesnt excuse it but it explain it . men be suppose to be hyper masculine aggressive etc,2
202287,en,cleveland hoe gon tear bro up with the sexual harassment charge tho,1
202288,en,twitter inc twitter and facebook need a specific report function for sexual harassment amp misogyny online sign the petition ! via,3
202289,en,if you know the language you will find that the journalist question get a unrelated answer and she just straight forward say i do not write anything about sexual harassment .,0
202290,en,thank for the sexual harassment . i didnt realize that wa apart of my insurance coverage . and the np forget to send in the prescription on top of it .,2
202291,en,the guy fire from from fox for sexual harassment of coworkers ?,3
202293,en,i wa tremble when i saw video bw tj and shanaia i exp sexual harassment i know what it look like kung kuya ka lang o nagtitake advantage sa babae ... sorry i can not finish the video ... i hope may housemate na pumuna kay tjforce evict tjprotect shanaia gomez,3
202294,en,in 2014 hermain cain wa accuse of sexual harassment of several woman . see . he suspend his campaign . he wa a tea party member . trump choose him a a cabinet member . he wa accuse of use federal money to fix his house .,3
202295,en,might want to sit this one out .,0
202296,en,lincoln project stand for gay sexual harassment and race fraud .,0
202298,en,berkeley friend do you know someone who have experience deal with the center for student conduct ? ask for a close friend who receive a letter amp be work through the process . would appreciate any help not a sexual harassment case not involve faculty.thanks,0
202300,en,after i outline what he do he get a chance to respond . ironically his response be all about other instance of sexual harassment and bully not the one i mention jn the addendum . he basically admit a pattern of terrible behavior .,0
202301,en,she be suffer from the big case of impostor syndrome ever because she be an impostor ! put in office purely because of her racial and sexual identity .,1
202302,en,njäää the majority of the population ha clear enough sexual identity for evolution and sexual selection to work just fine while at the same time sex a a spectrum be a real thing for a small to medium size minority .,0
202305,en,so be the go to register a x or just for the moment when everyone be make a production of their sexual identity . good grief this world of young people be mess up,0
202306,en,one of the great aspect of most bate club be that regardless of your sexual identity or prefer sexual position you can find community and selfpleasure in these communal drive space . check out this 2019 gq article to dive deep into this topic,0
202307,en,kid struggle with sexual identity issue arent the only one who need to hear these conversation . all kid could benefit from a curriculum that educate on these issue . understand lead to tolerance .,0
202308,en,how long have you be brag about your border response ? a year now ? and base on your almost daily fearmongering about drug and alien cross the border it ha be an absolute failure ! go back to your day job a fear monger on book sexual identity the economy !,0
202309,en,nothing new under the sun the agenda be go forward.lets stand up a believers.my prayer go to those struggle with their sexual identity may god give you a revelation that you be his . your sex doesnt give you an identity .,0
202311,en,a a bisexual i feel comfortable in assert that be by far the most annoy sexual identity that get put in the acronym .,0
202312,en,fuck off . pronoun be not equal to gender nor sexual identity . loser,0
202313,en,i will never understand how nigga be worry about someone sexual identity and lifestyle unless they be date . but even then why be you worry about what others that you dont know personally do .. ?,0
202314,en,i just dont get how people can feel threaten by someone gender identity or sexual identity richard . think we be good than that .,0
202317,en,my classmate choose homosexual in the find your valentine site in college say she think homo homosapiens not a sexual identity . girl ? ?,0
202318,en,for bring story of find pride in your gender identity amp sexual identity into your classroom with our free curriculum for about the narrative hero of . .,0
202319,en,when i invest into a project i dont care about the founder criminal record age or race or sex or sexual identity . only one thing matter . hisher trustworthiness and ready able will to deliver anything what be the project main aim goal . everyone deserve a chance,0
202320,en,tell me how it be your business to discus any other person sexual identity at all . what do you care if they arent bother you ? personally you can identify a a goose and it doesnt bother me .,0
202321,en,im just be a good friend and u turn it into sexual orientation,0
202322,en,these comment be absolutely not a reflection of our organization mission and value . bidmc be commit to provide equitable care to all patient regardless of vaccination status race gender sexual orientation income level or any other factor .,0
202323,en,maybe he wa rob and kill and it didnt have a thing to do with his sexual orientation .,0
202324,en,youre base your opinion on a general idea of the word discrimination . discrimination be a legal term that apply to specific establish protect class like sexual orientation . thats why you can refuse service to a person base on a mask but not base on be gay .,0
202325,en,i be put together a lecture on model stis and be struggle with how to best use word associate with assumption of binary gender and sexual orientation . any recsreferences on balance acknowledge diversity with the use of assumption for model practicality ?,0
202326,en,hate to say this guy but i never saw race gender sexual orientation or politics a classifier grow up . i never saw the need to know these thing in order to treat others with the same dignity a any human be . then i watch the news . now it all i we see .,0
202327,en,listen to your podcast tday . there be no reason any teacher shld be have a discussion w their student concern sexual orientation or gender theory or their personal relationship . school district need to rethink such lunacy before hire .,0
202328,en,i dont give a fuck about label . like if someone put a gun in my mouth and tell me to say my sexual orientation i would probably say murrrphhhur .,0
202329,en,can math teacher just stick to teach math social study stick to social study .. i never remember a teacher come into my classroom grow up and explain to me what they be their sexual orientation .. etc . they need to get back to teach the 3 r and thats it .,0
202330,en,everyone regardless of the color of their skin or someone sexual orientation gender deserve to be treatedseen a equal ! ! it 2022 people time to grow tfumy sincere apology if ive hurt anyone wtweet . im aim for the ignorant bag that wont accept the truth,0
202331,en,a far a i understand it queer something be about deliberately do it badly in order to highlight it inadequacy . i dont think thats fair on wittgenstein . also i suspect his social background wa at least a important a his sexual orientation .,0
202332,en,when it come intersex it a term i grow to use not one i wa bear comfortable with . someone may have a similar diagnosis to me and not use that terminology . intersex be not strictly relate to sexual orientation or gender identity either it about sex characteristic .,0
202333,en,world a hack group on tuesday release data from an israeli date website that disclose user sexual orientation and status .,0
202334,en,see i imagine a future where neighbor arent segregate by the color of ur skin or gender or sexual orientation or generation of arbitrary racist policy but by the internal network architecture of the new neighborhood .,0
202335,en,same way sexual orientation be . it can change on it own but can not be change intentionally through any current method and attempt to do so ha prove to be extremely harmful .,0
202336,en,they pick people for their skin color sexual orientation or political affiliation competency ! sad,0
202337,en,your not allow to discriminate against anyone for their race religion or sexual orientation but it ok for the government to discriminate against the vaccinate and unvaccinated . crazy .,0
202338,en,all israeli citizen have equal right regardless of race religion ethnicity gender sexual orientation .,0
202339,en,when bully use a sexual orientation insult theyre not say that they think youre gay and you should be insult for no reason a there nothing wrong with be gay . theyre say you should be insult because they think be gay be a bad thing . 615,0
202340,en,im literally asexual it not that serious . it about want sex or not there no oppression there unless there also intersectionality with sexual orientation or race or gender .,0
202341,en,he a grow as man ... why tf doe he care about another grow man sexuality bro .. kinda sus,0
202342,en,ariana us the h method of hint she could be unlabled and everyone be obsess with that . we have to normalise them not talk about their sexuality bc it normalise the community ok arinanaxstyles420 but hear me out some people be just straight .,0
202343,en,spend a great portion of my life struggle with try to be ci and hat whenever someone comment on me lookingacting like a boy when i wasnt fempresenting enough for them . it wasnt until last year that i realize i wa nonbinary after tune into gendersexuality,0
202344,en,whatever you feel no matter what be your sexuality you will always be my precious and beloved friend youre valid and amaze !,0
202345,en,ah okay so youre try to frame homophobic hate speech a a difference of opinion.free clue for you and all the other dimwit who think thats a valid tactic you dont get to disagree with someone sexuality or their race or sex . this isnt a topic for debate .,0
202346,en,if you see me be horny on the tl i dont care cause i have a healthy relationship with my sexuality .,0
202347,en,whats the sexuality where youre attract to men but you hate have sex worth them and you need to be dominate them in all aspect of life,0
202349,en,gross reallywho would possibly ask their professor about their sexuality ?,0
202350,en,let me clarify i couldnt give less of a fuck what hunter actual sexuality be consider it not my business but it upset to see someone label themself a a lesbian and capitalize off of that while not actually be a lesbian ? if that make sense . idk just spitballing,0
202351,en,haha there it be a lack of self awareness reveal itself if you thing i be misogynistic a someone who love woman and doesnt care which sexuality your be but fail to comprehend live life in a virtual world when what we have be truly amaze gn,0
202352,en,this man entire fuck quest be about him be gay . tevinter society and in turn halwards specific problem with dorian be that he wont be involve with or even marry a woman . of all the npc in dai he be the one whose sexuality should absolutely not be fuck with .,0
202354,en,steal this from what be we ? 10 moots10 weve interacted10 weve dmed10 youve see my face 10 hear my voice10 have my other socials10 know my sexuality10 know my age10 know my country10 gc together,0
202355,en,bradley be truly one of the first tv character ive see myself reflect in in a real way other than superficially so my investment be a little bias of course but it be such an incredibly important complexity to portray period moreso in someone explore sexuality .,0
202356,en,track one menstrual cycle and i mean track like figure out when you ovulate etc . be unironically an empower way for woman to take charge of their own sexuality .,0
202357,en,lead scientist who actually study human sexuality believe be transgender be the result of brainnervous system intersexuality . there be no doubt of there be a biological connection .,0
202358,en,down to check my cock wasnt be too prominent then laugh take your hand to walk side by side back to concierge and jermaine who seem very amused.i didnt know what the general consensus wa among staff about my sexuality im sure it have be a topic at some but i,0
202359,en,the way people be try to meddle amp make conspiracy about h love life amp sexuality be rlly weird to me . why be her romanticpersonal life so important to people it literally doesnt affect u at all lol . whether she see itis bother by it or not isnt the problem either .,0
202361,en,i get a new shirt at work at it be the bad material ever,0
202362,en,yo it shirt he give new york wa funny .,0
202363,en,the peds shelf be just internal medicine wear a poorly fit kid shirt and im tire of pretend it not,0
202364,en,tom take a deep breathe . loosen up your shirt thats one size too small .,0
202365,en,i think he wear a black shirt lol i dont remember but i think,0
202366,en,somethin about the big t shirt no pant combo feel so good so right,0
202367,en,last year my t shirt wa cover in blood yea i use to sit in nosebleed,0
202368,en,tulsa scanner hit amp run fat mexican male wear a white shirt flee on foot request a perimeter amp a k9 be the helo up ? nope . ha !,0
202369,en,from this long haired buff and chisel on a crisp white shirt that ha too many unbutton button but still not enough skin expose taecthey should have just unbutton his shirt,0
202370,en,pavards first ever great game in a bayern shirt in an important game . a timely one,0
202371,en,week a well so if you pay domestic ship after thursday night i wont be able to make the label until next week but im hop to have it package and ready ! ill be get up the form for the jp shirt hopefully tomorrow a well !,0
202372,en,yessssss when the planet be align i will own that shirt !,0
202373,en,no gifs but a funny tee shirt in the window at provincetown .,0
202374,en,oh it be so bad.tweens rescue their navy seal father from a nk prison camp almost get shoot down by u jet but be save at the last second because one of them be wear a bruce springsteen shirt.i have not make a word of that up .,0
202375,en,jimin in a white button up shirt always and will forever hit different,0
202376,en,yes sometimes the button just wan na pop like lem me wear this shirt in peace,0
202377,en,my brother in law hate the cowboy and lose a bet now he have to wear a dallas cowboy shirt lmao how bout dem cowboy,0
202378,en,who say you cant wear a grammar lesson ? my student love my shirt !,0
202379,en,sure wish instagram didnt crop my picture so the full radness of my shirt could be behold .,0
202380,en,emerald forest tshirt by the mountain t.cooip5srm7ai,0
202381,en,haha so if your dad car need to be wash after every 5days thats when you could bag the money,0
202383,en,yes jesus wa famous for tell people to f off .,0
202384,en,epitome of skank quid pro quo for position and advancement .,0
202385,en,some pic from the bad guy club 6 this year ! hell shriner pest bone head and space skank .,0
202386,en,belated bear day bless to the ukgh legend lethal bizzle np fester skank prod by diztortion on theall abroad alist w yfm .,0
202387,en,my ex boyfriend from high school decide his new thing wa to message me on snapchat every other day and call me a skank.proving yet again i really go for some winner,3
202388,en,just drop off your electrical good and voluminous evidence and go .... skank,0
202389,en,nobody call my skank a skank ! this bar fight wa awesome ! !,0
202391,en,because a lot of the time it someone close to you,0
202392,en,you call me a skank yet be tell me to grow up . your priority be wrong . that shitty bedsit no boyfriend and no car ha make you a bitter old woman .,1
202393,en,id have to see em myself 1st to tell if youre a skank or not . other than that that clown !,1
202394,en,omg wtf be wrong with u. youre just a horrible batch ! thats must be the reason you marry a pedophile . dum as skank !,1
202395,en,damn rockefeller skank be a bop forget about that song until it play at work .,0
202397,en,not a fan of the guy but get ta give him credit . genius work aubrey . cant impregnate a skank .,1
202398,en,you just describe donald trump you skank . dumbass trumpanzees like you need to be deprogrammed or desomething .,1
202399,en,this be not acceptable !,0
202400,en,obvs thats not why i do it im just a lazy skank !,0
202401,en,always the victim but your mum be a slag,1
202402,en,london slag party,0
202403,en,fuck off u slag why be u try to force a man onto me ? ? ? not very feminist of u,1
202404,en,check out this list i just add to my closet vintage le smith bittersweet slag glass bowl pedestal candy dish compote orange .,0
202405,en,all up for banter but this chat about gvb and maloney about be small be absolutely tragic . see grow men and woman slag their height thats all new level of fuck weird man .,0
202406,en,people who mostly on here say someone elses opinion on football matter be clueless and slag them off for it be sad imo . come up with a educate reason why you disagree with that person have a debate . slag them off isnt very clever .,0
202407,en,why ya buy a whole turkeh to make a broth ya daft slag,0
202408,en,on lbc to slag off boris johnson for 3 hoursmeanwhile keir starmer plan to get labour mp to support boris in the common votewhy be tory mp the only serious opposition ?,0
202409,en,it wa literal fuck garbage . i know there a propensity to slag something off when youre on the oppose side of it but honestly that wa one of the bad thing ive ever read masqurading a a serious piece .,0
202410,en,im not that kind of person to slag people off behind a keyboard but what a pathetic clown and wimp you be . you cant even keep your word this be your insurance bc youve get to be see do something if shit hit the fan when it crystal clear these measure aint work .,0
202411,en,come hear gav and helen slag off coldplay this week on list of list ! ! !,0
202412,en,well that find kind of put my meagre slag to shame,0
202413,en,i work in coal fire plant 32 years.there be no way to burn coal cleanly . none . it can not be do . anyone who pretend otherwise be lying.just the slag the remain end up in ocean and river and air . and thats only a small part of it .,0
202414,en,end of season 2 round up otis be . a slag and i hate ola aimee eric and maeve be faves,0
202415,en,so far ive be call a slag and a wench by walsall fan in reply to me tweet about football the misogyny be rife tonight .,3
202416,en,this be a slag fest but these fucker get body okay b ! ! bebsvsbbxhdhshxbf,0
202417,en,at 16 he get his parent his representation all adult be heavily influence his decision . no decision that big at 16 be 100 him . i wish hed stay but im never go to slag off a kid,0
202418,en,big slag of a spicy ruby to blow the remnant of this omi out the window and it back to lick bannister in town,0
202419,en,social medium . fan cant wait to slag off their own after a defeat .,0
202420,en,mod honestly fuck off the man score the equaliser today but all you can do be slag him off from dubai why dont you cut him so slack you fuck hypocrite . muppet be my only word for you,0
202421,en,i cant see this meme anymore it piss me off i want to slap them,0
202422,en,i tell yall every time i think i find sb god slap me with his sandles,0
202423,en,nah a boogie artist album still slap so brazy,0
202425,en,be it a draw of your red face slap head after be boot out due to unethical coercion of nh employee and care worker over no jab no job policy ?,0
202426,en,open smartnews and read ohio school warn parent about slap a teacher tiktok challenge here to read it on the web tap here,0
202427,en,i go back and forth between id let him slap me again and okay imma pull his hair so hard he go bald forever,0
202428,en,bull . it hasnt be a slap and you already delete the tweet about him not do anything with the swift system . i cant believe you have fan,0
202429,en,okay these all slap but your kill me with dunsparce granny . she must be protect at all cost .,0
202430,en,that new tool pretty slap ngl,0
202431,en,ash moan a her ball slap widow groan a little nervously see mercy move in closeruhh what ya do ?,0
202432,en,i need someone to professionaly slap me and tell me im a piece of shit when i procrastinate,0
202433,en,cant believe im say this but the new reeses peanut butter cup with the potato chip bite kinda slap,0
202434,en,gqp cultist just misbehavin . slap him silly .,0
202435,en,not a huge fan of a good bite of p4s soundtrack but god do the bos theme slap,0
202436,en,me neither . im not a prude . i just dont like have a dick slap me in the face when im not expect it .,3
202437,en,know myself ill probably be submissive in public but defiant in private so fake domesticity slapslapkiss i wont say im in love type of thing,1
202438,en,oh my god epic make an example out of me instead of a slap on the wrist,0
202439,en,ring ding dong gon na slap jonghyun hit that autotune right at the bust,0
202440,en,jack black a bowser ? ? ? ? this movie be gon na slap,0
202441,en,the fact that my pet name be purposely stupid .. knee slapper lmaoocmon here lil ben,0
202442,en,me wan na hear a knee slapper ? me my life,0
202443,en,i cant believe ive never hear this absolute slapper,0
202444,en,if youve finish go after the cruel horse slapper how about you take these folk on ? that id like to see,0
202445,en,whoohahaha . thats a knee slapper that might never get old . who know manchin wa a comedian .,0
202446,en,another kneeslapper from twat baio !,0
202447,en,i cant lie lil top and da baby get ta a slapper on their hand im rey mosh,0
202448,en,damn be out the gate with an absolute slapper.with an act of this caliber sign on early the other band be gon na flock to the event now just watch .,0
202449,en,me anytime i discover a new slapper,0
202450,en,it a new title by yacht club and it look like an absolute slapper . you can wishlist on steam can also contribute to the kickstarter if youre feel generous,0
202451,en,wonder if he wa able to make the time to get that slapper round the back of the build and give her a ride ? ?,2
202452,en,asta everyone out of the way ! as slapper be here ! dont let him pinch your butt ! asta,1
202453,en,he be even the best slapper of all the time,0
202454,en,this be a good onea real knee slapper,0
202455,en,other than piss aucklanders off what wa the point of yesterday . no message wa communicate other than look at me i be world famous on facebook . should have get that slapper up from wgtn and she could have walk over naked . that would have get some attention ! ! !,1
202456,en,tough shoot for you to face wrister snapper or slapper .,0
202457,en,glennyoungkin be go to be a great conservative governor . also a great lib slapper like the great president donaldjtrump who wa not afraid to tell the crazy leave where to go ! we r tire of the lie of the pandemic we r tire of be call racisttired of the the tran shit !,1
202458,en,sadly doesnt mean anything . courtois wa a habitual chest slapper,0
202459,en,the grid be good another knee slapper,0
202460,en,demographic decline be quite the knee slapper .,0
202461,en,i think only fan be prostitutionwow i didnt know slut sham wa good in the street but apparently it be ! what this woman doe to make money be none of your business shes clearly happy with what shes do and doesnt need2 ?,2
202462,en,a soft whine follow the length be finally hilted . that plush rear press firmly to the others groin keep her nice and press close to her lover . soft whine freely flow from the butt slut mouth .,1
202463,en,just ur friendly neighbourhood emo femboy 10 for more from this set,0
202465,en,i need to be drag into a dark alley and fuck like a slut .,1
202466,en,this song make me feel like a slut and i like it,0
202467,en,if britneys a catholic slut im also a catholic slut .,0
202468,en,i know the song wa call slut him out but some of the lyric still shock me lol,0
202469,en,ull get lotta of slut sham and for nth,2
202470,en,yooooooo mmyyyy ..... it be like see a fantasy of a very macho man become a sweet princess who be really a fuck slut ... thank for how you share,1
202471,en,girl group will literally slut drop roll on the floor do literal acrobatics on stage while belt just for yall to simp over guy in mesh top hump into their own hand just say,1
202472,en,kim petras treat me like a slut official visualizer via,1
202473,en,hello it me radabots a slut for a great musical score uwu,0
202474,en,just regalia slowly become the monster she never want to be force brenda into chastity while endlessly breed her until she become a stockholme syndrome slut .,1
202475,en,that wasnt say to stop . so guess youre love them . she smirk and give one more . this time keep her hand on the girl rear and grope it .,3
202476,en,hmmm so and show to the world for i be,1
202477,en,stop shoot amateur porn on it save some space you slut !,1
202478,en,i cant believe i post this and spend my entire bus ride to work slut sham him and i have completely forget about this most holy of day it still count a celebrate if it wasnt originally plan that way right ?,0
202480,en,you lie like hell you always take your shirt off every 5 min for what ? ! you slut monkey,0
202481,en,i love drain my little slutbag it his first game,1
202483,en,right now my body be merely a vector for the rona a finelytuned vehicle for airborne contagion a big ol slutbag for omicron .,0
202484,en,cant believe the iconic don you fuck slutbag moment wa 8 year ago akdhajhdajjahshh,1
202485,en,i want to slide your panty over and insert my penis and breed you and ejaculate inside you make you a slutbag whore,1
202486,en,save the day by become another breedable slutbag to bring the world into peace and lust,0
